<?xml version="1.0" encoding="utf-8" standalone="no"?><!DOCTYPE Entry SYSTEM "NounModel.dtd"><?xml-stylesheet type="text/xsl" href="NounRenderTemplate2.xslt"?><Entry category="Substantiv">
<Stichwort Audio="true">Management</Stichwort>
<Einheit>8</Einheit>
<Anteil>Text</Anteil>
<Genus>das</Genus>
<Pluralform>o.Pl.</Pluralform>
<GenitivSingular/>

<zusammengesetzteWörter>
	<KompositaCollection>
		<_K/>
		<K_/>
	</KompositaCollection>
	<abgeleiteteWörter/></zusammengesetzteWörter>

<Synonymegruppe>
	<Sym/>
</Synonymegruppe>
<Antonymegruppe>
	<Anm/>
</Antonymegruppe>

<Kollokationen>
<K/>
</Kollokationen>

<AllgemeineErläuterungen>
	<Eintrag>
		<Chinesisch>管理</Chinesisch>
		<BeispielSammlung>
			<Beispiel>
				<Satz>Wer studiert Management?</Satz>
				<Übersetzung>谁在学管理学？</Übersetzung>
			</Beispiel>
		</BeispielSammlung>
	</Eintrag>
</AllgemeineErläuterungen>

</Entry>
