<?xml version="1.0" encoding="utf-8" standalone="no"?><!DOCTYPE Entry SYSTEM "NounModel.dtd"><?xml-stylesheet type="text/xsl" href="NounRenderTemplate2.xslt"?><Entry category="Substantiv">
  <Stichwort Audio="true">Ei</Stichwort>
  <Einheit>5</Einheit>
  <Anteil>Einführung</Anteil>
  <Genus>das</Genus>
  <Pluralform>Eier</Pluralform>
  <GenitivSingular/>
  <zusammengesetzteWörter>
    <KompositaCollection>
      <K_>Eizelle (卵细胞)</K_>
    </KompositaCollection>
    <abgeleiteteWörter/>
  </zusammengesetzteWörter>
  <Synonymegruppe/>
  <Antonymegruppe/>
  <Kollokationen/>
  <AllgemeineErläuterungen>
    <Eintrag>
      <Chinesisch>鸡蛋</Chinesisch>
      <BeispielSammlung>
        <Beispiel>
          <Satz>Woher kommt das Ei?</Satz>
          <Übersetzung>这个鸡蛋哪来的?</Übersetzung>
        </Beispiel>
      </BeispielSammlung>
    </Eintrag>
  </AllgemeineErläuterungen>
</Entry>
