<?xml version="1.0" encoding="utf-8" standalone="no"?><!DOCTYPE Entry SYSTEM "NounModel.dtd"><?xml-stylesheet type="text/xsl" href="NounRenderTemplate2.xslt"?><Entry category="Substantiv"><Stichwort>Mahnung</Stichwort><Einheit>3</Einheit><Anteil>1</Anteil><Genus>die</Genus><Pluralform>Mahnungen</Pluralform><GenitivSingular>Mahnung</GenitivSingular><zusammengesetzteWörter><KompositaCollection></KompositaCollection><abgeleiteteWörter></abgeleiteteWörter></zusammengesetzteWörter><Synonymegruppe></Synonymegruppe><Antonymegruppe></Antonymegruppe><Kollokationen></Kollokationen><AllgemeineErläuterungen><Eintrag><Chinesisch>提醒</Chinesisch><BeispielSammlung><Beispiel><Satz>Mahnung an Kaiser</Satz><Übersetzung>提醒皇上</Übersetzung></Beispiel></BeispielSammlung></Eintrag></AllgemeineErläuterungen></Entry>