<?xml version="1.0" encoding="utf-8" standalone="no"?><!DOCTYPE Entry SYSTEM "NounModel.dtd"><?xml-stylesheet type="text/xsl" href="NounRenderTemplate2.xslt"?><Entry category="Substantiv">
  <Stichwort Audio="true">Firma</Stichwort>
  <Einheit>6</Einheit>
  <Anteil>Text</Anteil>
  <Genus>die</Genus>
  <Pluralform>Firmen</Pluralform>
  <GenitivSingular>Firma</GenitivSingular>
  <zusammengesetzteWörter>
    <KompositaCollection>
      <_K>Baufirma</_K>
      <K_>Firmenchef</K_>
    </KompositaCollection>
    <abgeleiteteWörter/>
  </zusammengesetzteWörter>
  <Synonymegruppe/>
  <Antonymegruppe/>
  <Kollokationen/>
  <AllgemeineErläuterungen>
    <Eintrag>
      <Chinesisch>公司</Chinesisch>
      <BeispielSammlung>
        <Beispiel>
          <Satz>Ich arbeite bei Firma Borsch.</Satz>
          <Übersetzung>我在公司工作。</Übersetzung>
        </Beispiel>
      </BeispielSammlung>
    </Eintrag>
  </AllgemeineErläuterungen>
</Entry>
