<?xml version="1.0" encoding="utf-8" standalone="no"?><!DOCTYPE Entry SYSTEM "NounModel.dtd"><?xml-stylesheet type="text/xsl" href="NounRenderTemplate2.xslt"?><Entry category="Substantiv">
  <Stichwort Audio="true">Bier</Stichwort>
  <Einheit>5</Einheit>
  <Anteil>Einführung</Anteil>
  <Genus>das</Genus>
  <Pluralform>Biere</Pluralform>
  <GenitivSingular/>
  <zusammengesetzteWörter>
    <KompositaCollection>
      <K_>Bierflasche</K_>
      <K_>Bierglas</K_>
    </KompositaCollection>
    <abgeleiteteWörter/>
  </zusammengesetzteWörter>
  <Synonymegruppe/>
  <Antonymegruppe/>
  <Kollokationen>
    <K>ein Glas Bier</K>
  </Kollokationen>
  <AllgemeineErläuterungen>
    <Eintrag>
      <Chinesisch>啤酒</Chinesisch>
      <BeispielSammlung>
        <Beispiel>
          <Satz>Trinken Sie Bier?</Satz>
          <Übersetzung>喝啤酒吗？</Übersetzung>
        </Beispiel>
        <Beispiel>
          <Satz>Wollen wir nicht etwas Bier?</Satz>
          <Übersetzung>我们不买点啤酒吗？</Übersetzung>
        </Beispiel>
      </BeispielSammlung>
    </Eintrag>
  </AllgemeineErläuterungen>
</Entry>
