<?xml version="1.0" encoding="utf-8" standalone="no"?><!DOCTYPE Entry SYSTEM "NounModel.dtd"><?xml-stylesheet type="text/xsl" href="NounRenderTemplate2.xslt"?><Entry category="Substantiv"><Stichwort>Tugend</Stichwort><Einheit>3</Einheit><Anteil>2</Anteil><Genus>die</Genus><Pluralform>Tugenden</Pluralform><GenitivSingular>Tugend</GenitivSingular><zusammengesetzteWörter><KompositaCollection></KompositaCollection><abgeleiteteWörter></abgeleiteteWörter></zusammengesetzteWörter><Synonymegruppe></Synonymegruppe><Antonymegruppe></Antonymegruppe><Kollokationen><K>Tugenden bündeln</K></Kollokationen><AllgemeineErläuterungen><Eintrag><Chinesisch>道德</Chinesisch><BeispielSammlung></BeispielSammlung></Eintrag></AllgemeineErläuterungen></Entry>