<?xml version="1.0" encoding="utf-8" standalone="no"?><!DOCTYPE Entry SYSTEM "NounModel.dtd"><?xml-stylesheet type="text/xsl" href="NounRenderTemplate2.xslt"?><Entry category="Substantiv">
  <Stichwort Audio="true" Bild="99.jpg">Flasche</Stichwort>
  <Einheit>5</Einheit>
  <Anteil>Übungen</Anteil>
  <Genus>die</Genus>
  <Pluralform>Flaschen</Pluralform>
  <GenitivSingular>Flasche</GenitivSingular>
  <zusammengesetzteWörter>
    <KompositaCollection>
      <_K>Bierflasche</_K>
    </KompositaCollection>
    <abgeleiteteWörter/>
  </zusammengesetzteWörter>
  <Synonymegruppe/>
  <Antonymegruppe/>
  <Kollokationen>
    <K>eine Flasche Bier</K>
  </Kollokationen>
  <AllgemeineErläuterungen>
    <Eintrag>
      <Chinesisch>瓶</Chinesisch>
      <BeispielSammlung>
        <Beispiel>
          <Satz>Möchten Sie eine oder zwei Flaschen Wein?</Satz>
          <Übersetzung>您要一瓶酒还是两瓶？</Übersetzung>
        </Beispiel>
      </BeispielSammlung>
    </Eintrag>
  </AllgemeineErläuterungen>
</Entry>
