<?xml version="1.0" encoding="utf-8" standalone="no"?><!DOCTYPE Entry SYSTEM "NounModel.dtd"><?xml-stylesheet type="text/xsl" href="NounRenderTemplate2.xslt"?><Entry category="Substantiv">
<Stichwort Audio="true">Magen</Stichwort>
<Einheit>9</Einheit>
<Anteil>Einführung</Anteil>
<Genus>der</Genus>
<Pluralform>Mägen</Pluralform>
<GenitivSingular/>

<zusammengesetzteWörter>
	<KompositaCollection>
		<_K>Hühnermagen</_K>
		<K_>Magenbeschwerden</K_>
	</KompositaCollection>
	<abgeleiteteWörter/></zusammengesetzteWörter>

<Synonymegruppe>
	<Sym/>
</Synonymegruppe>
<Antonymegruppe>
	<Anm/>
</Antonymegruppe>

<Kollokationen>
<K/>
</Kollokationen>

<AllgemeineErläuterungen>
	<Eintrag>
		<Chinesisch>胃</Chinesisch>
		<BeispielSammlung>
			<Beispiel>
				<Satz>Mein Magen tut mir weh.</Satz>
				<Übersetzung>我的胃疼。</Übersetzung>
			</Beispiel>
		</BeispielSammlung>
	</Eintrag>
</AllgemeineErläuterungen>

</Entry>
