<?xml version="1.0" encoding="utf-8" standalone="no"?><!DOCTYPE Entry SYSTEM "NounModel.dtd"><?xml-stylesheet type="text/xsl" href="NounRenderTemplate2.xslt"?><Entry category="Substantiv">
<Stichwort>Klößchen</Stichwort>
<Einheit>5</Einheit>
<Anteil>Text</Anteil>
<Genus>das</Genus>
<Pluralform>Klößchen</Pluralform>
<GenitivSingular/>

<zusammengesetzteWörter>
	<KompositaCollection>
		<_K/>
		
	</KompositaCollection>
	<abgeleiteteWörter/>
</zusammengesetzteWörter>

<Synonymegruppe>
	<Sym/>
</Synonymegruppe>
<Antonymegruppe>
	<Anm/>
</Antonymegruppe>

<Kollokationen>

</Kollokationen>

<AllgemeineErläuterungen>
	<Eintrag>
		<Chinesisch>小丸子</Chinesisch>
		<BeispielSammlung>
			<Beispiel>
				<Satz>Es gibt zu Mittag Klößchen.</Satz>
				<Übersetzung>中午有小丸子吃。</Übersetzung>
			</Beispiel>
		</BeispielSammlung>
	</Eintrag>
</AllgemeineErläuterungen>

</Entry>

