<?xml version="1.0" encoding="utf-8" standalone="no"?><!DOCTYPE Entry SYSTEM "NounModel.dtd"><?xml-stylesheet type="text/xsl" href="NounRenderTemplate2.xslt"?><Entry category="Substantiv">
  <Stichwort Audio="true">Cappuccino</Stichwort>
  <Einheit>5</Einheit>
  <Anteil>Hörverstehen</Anteil>
  <Genus>der</Genus>
  <Pluralform>Cappuccinos</Pluralform>
  <GenitivSingular/>
  <zusammengesetzteWörter>
    <KompositaCollection/>
    <abgeleiteteWörter/>
  </zusammengesetzteWörter>
  <Synonymegruppe/>
  <Antonymegruppe/>
  <Kollokationen/>
  <AllgemeineErläuterungen>
    <Eintrag>
      <Chinesisch>卡布奇诺咖啡</Chinesisch>
      <BeispielSammlung>
        <Beispiel>
          <Satz>Ich hätte gern einen Cappuccino.</Satz>
          <Übersetzung>我想要一杯咖啡。</Übersetzung>
        </Beispiel>
      </BeispielSammlung>
    </Eintrag>
  </AllgemeineErläuterungen>
</Entry>
