<?xml version="1.0" encoding="utf-8" standalone="no"?><!DOCTYPE Entry SYSTEM "NounModel.dtd"><?xml-stylesheet type="text/xsl" href="NounRenderTemplate2.xslt"?><Entry category="Substantiv">
<Stichwort Audio="true">Polizei</Stichwort>
<Einheit>4</Einheit>
<Anteil>Übungen</Anteil>
<Genus>die</Genus>
<Pluralform>Polizeien</Pluralform>
<GenitivSingular/>

<zusammengesetzteWörter>
	<KompositaCollection>
    <K_>Polizeibeamte</K_>
    <K_>Verkehrspolizei</K_>
  </KompositaCollection>
	<abgeleiteteWörter/></zusammengesetzteWörter>

<Synonymegruppe>
	<Sym/>
</Synonymegruppe>
<Antonymegruppe>
	<Anm/>
</Antonymegruppe>

<Kollokationen>
  <K>Polizei rufen</K>
</Kollokationen>
  <AllgemeineErläuterungen>
    <Eintrag>
    <Chinesisch> 警察,警察局</Chinesisch>
  <BeispielSammlung>
    <Beispiel>
      <Satz>Die Polizei ist dort.</Satz>
      <Übersetzung>警察在那里。</Übersetzung>
    </Beispiel>
    <Beispiel>
      <Satz>Ich muss morgen zu Polizei.</Satz>
      <Übersetzung>我必须明天去警察局。</Übersetzung>
    </Beispiel>
  </BeispielSammlung>
    </Eintrag>
  </AllgemeineErläuterungen>
</Entry>
