<?xml version="1.0" encoding="utf-8" standalone="yes"?><!DOCTYPE Entry SYSTEM "NounModel.dtd"><?xml-stylesheet type="text/xsl" href="NounRenderTemplate2.xslt"?><Entry category="Substantiv">
  <Stichwort>Alkohol</Stichwort>
  <Einheit>4</Einheit>
  <Anteil>Text</Anteil>
  <Genus>der</Genus>
  <Pluralform>Alkohole</Pluralform>
  <GenitivSingular>Alkohols</GenitivSingular>
  <zusammengesetzteWörter>
    <KompositaCollection>
      <K_>Alkoholtest</K_>
    </KompositaCollection>
    <abgeleiteteWörter>
      <hierzu category="Adjektiv">alkoholisch</hierzu>
      <hierzu category="Adjektiv">alkoholfrei</hierzu>
      <hierzu category="Substantiv">Alkoholiker</hierzu>
    </abgeleiteteWörter>
  </zusammengesetzteWörter>
  <Synonymegruppe>
    <Sym>alkoholische Getränke</Sym>
  </Synonymegruppe>
  <Antonymegruppe>
    <Anm>alkoholfreie Getränke</Anm>
  </Antonymegruppe>
  <Kollokationen>
    <K>Alkohol trinken</K>
  </Kollokationen>
  <AllgemeineErläuterungen>
    <Eintrag>
      <Chinesisch>酒精饮料</Chinesisch>
      <BeispielSammlung>
        <Beispiel>
          <Satz>Sie trinkt auch keinen Alkohol.</Satz>
          <Übersetzung>她也不喝酒。</Übersetzung>
        </Beispiel>
      </BeispielSammlung>
    </Eintrag>
    <Eintrag>
      <Chinesisch>酒精</Chinesisch>
      <BeispielSammlung>
        <Beispiel>
          <Satz>Das Beer hat 5% Alkohol.</Satz>
          <Übersetzung>这种啤酒含5%的酒精。</Übersetzung>
        </Beispiel>
        <Beispiel>
          <Satz>Er leidet under den Folgen des Alkohols.</Satz>
          <Übersetzung>他受着酒精的折磨。</Übersetzung>
        </Beispiel>
      </BeispielSammlung>
    </Eintrag>
  </AllgemeineErläuterungen>
</Entry>
