<?xml version="1.0" encoding="utf-8" standalone="no"?><!DOCTYPE Entry SYSTEM "NounModel.dtd"><?xml-stylesheet type="text/xsl" href="NounRenderTemplate2.xslt"?><Entry category="Substantiv">
  <Stichwort Audio="true">Ecke</Stichwort>
  <Einheit>6</Einheit>
  <Anteil>Text</Anteil>
  <Genus>die</Genus>
  <Pluralform>Ecken</Pluralform>
  <GenitivSingular/>
  <zusammengesetzteWörter>
    <KompositaCollection>
      <K_>Eckschrank(角橱)</K_>
      <K_>Eckball([足球])</K_>
    </KompositaCollection>
    <abgeleiteteWörter/>
  </zusammengesetzteWörter>
  <Synonymegruppe/>
  <Antonymegruppe/>
  <Kollokationen/>
  <AllgemeineErläuterungen>
    <Eintrag>
      <Chinesisch>角落</Chinesisch>
      <BeispielSammlung>
        <Beispiel>
          <Satz>Die katze läuft in die Ecke.</Satz>
          <Übersetzung>猫跑到角落了。</Übersetzung>
        </Beispiel>
        <Beispiel>
          <Satz>Ich suche meine Tasche an allen Ecken und Enden. Leider finde ich ihr nicht.</Satz>
          <Übersetzung>我到处都找遍了手提包可是还没找到。</Übersetzung>
        </Beispiel>
      </BeispielSammlung>
    </Eintrag>
  </AllgemeineErläuterungen>
</Entry>
