<?xml version="1.0" encoding="utf-8" standalone="no"?><!DOCTYPE Entry SYSTEM "NounModel.dtd"><?xml-stylesheet type="text/xsl" href="NounRenderTemplate2.xslt"?><Entry category="Substantiv">
  <Stichwort Audio="true" Bild="91.jpg">Farbe</Stichwort>
  <Einheit>7</Einheit>
  <Anteil>Text</Anteil>
  <Genus>die</Genus>
  <Pluralform>Farben</Pluralform>
  <GenitivSingular>Farbe</GenitivSingular>
  <zusammengesetzteWörter>
    <KompositaCollection>
      <_K>Augenfarbe</_K>
      <K_>Farbefernsehen</K_>
      <_K>Gesichtsfarbe</_K>
      <_K>Haarfarbe</_K>
      <K_>Farbofoto</K_>
    </KompositaCollection>
    <abgeleiteteWörter/>
  </zusammengesetzteWörter>
  <Synonymegruppe/>
  <Antonymegruppe/>
  <Kollokationen/>
  <AllgemeineErläuterungen>
    <Eintrag>
      <Chinesisch>颜色</Chinesisch>
      <BeispielSammlung>
        <Beispiel>
          <Satz>Die Farbe steht mir nicht besonders.</Satz>
          <Übersetzung>这种颜色不太适合我。</Übersetzung>
        </Beispiel>
        <Beispiel>
          <Satz>Die Farbe der Ampel sind rot, gelb und grün.</Satz>
          <Übersetzung>交通灯的颜色是红黄绿。</Übersetzung>
        </Beispiel>
      </BeispielSammlung>
    </Eintrag>
  </AllgemeineErläuterungen>
</Entry>
